{
  "schema_version": "1.0.0",
  "revision": 5,
  "updated_at": "2026-08-05T15:27:20.789805Z",
  "run": {
    "run_id": "R-20260805T152457Z-001279",
    "previous_run_id": null,
    "status": "completed",
    "started_at": "2026-08-05T15:24:57.404420Z",
    "deadline_at": "2026-08-05T17:24:57.404420Z",
    "reserve_minutes": 10,
    "dirty_shutdown": false
  },
  "objective": {
    "system_generation": "G-0001",
    "evidence_stage": "baseline",
    "active_hypothesis_id": "H-0001",
    "active_experiment_id": null,
    "champion_strategy_id": null,
    "baseline_experiment_id": null
  },
  "budget": {
    "session_minutes": 120,
    "used_minutes": 2,
    "max_experiments": 1,
    "experiments_completed": 1,
    "trial_budget": 20,
    "trials_consumed": 1,
    "holdout_touch_budget": 1,
    "holdout_touches": 0
  },
  "data": {
    "manifest_path": "DATA_MANIFEST.json",
    "integrity_status": "validated",
    "latest_market_as_of": "2025-12-31"
  },
  "paper_account": {
    "account_id": null,
    "as_of": null,
    "base_currency": "USD",
    "equity": 0.0,
    "cash": 0.0,
    "gross_exposure": 0.0,
    "net_exposure": 0.0,
    "peak_equity": 0.0,
    "drawdown": 0.0
  },
  "blockers": [
    {
      "blocker_id": "B-0001",
      "severity": "critical",
      "status": "resolved",
      "description": "No point-in-time market dataset has been validated.",
      "owner": "data-integrity",
      "next_check": "Revalidate only when a new dataset snapshot is registered."
    },
    {
      "blocker_id": "B-0002",
      "severity": "high",
      "status": "open",
      "description": "EV-0001 measures the strategy from its second-session fill but measures the benchmark from the first-session open.",
      "owner": "skill-lifecycle-governance",
      "next_check": "Request human approval for EV-0002 and generation G-0002 with aligned benchmark timing."
    }
  ],
  "next_actions": [
    {
      "action_id": "A-0003",
      "priority": 1,
      "expected_information_gain": 1.0,
      "estimated_minutes": 20,
      "skill": "skill-lifecycle-governance",
      "description": "Propose EV-0002 and generation G-0002 with the benchmark entering on the strategy's first eligible execution session.",
      "success_criterion": "Human approval and an ADR authorize the generation transition before sealed files change.",
      "prerequisites": ["E-0001"]
    }
  ],
  "handoff": {
    "summary": "E-0001 finalized as block: Benchmark and strategy use different entry clocks, so excess return is not decision-valid.",
    "last_verified_artifacts": [
      "results/E-0001/metrics.json",
      "results/E-0001/validity.json",
      "results/E-0001/equity.csv",
      "results/E-0001/trades.csv",
      "results/E-0001/run.log",
      "results/E-0001/artifact-manifest.json",
      "results/E-0001/review.json"
    ],
    "next_action_id": "A-0003",
    "unresolved_risks": [
      "No baseline strategy",
      "No paper account",
      "Distributions are excluded from D-0001",
      "EV-0001 benchmark and strategy entry clocks are misaligned"
    ]
  },
  "integrity": {
    "last_validation_at": "2026-08-05T15:27:20.789805Z",
    "last_experiment_id": "E-0001",
    "validation_status": "valid"
  }
}
